Restaurant/Topic,Title,Body,Score,Num_Comments,Created_UTC,ID,URL,Subreddit,Type
Oak Barrel Public House,Last day to send a comment on WE Energies raising our rates even more,"WE is trying to build new methane gas plants, which based on how our bills work, would be used to justify jacking up our rates. They are already seeking to hike our rates for each of the next several years, and this would be additional ""cost of capital"" used to justify increases on top of that. And this has been hypothesized to largely be for the Microsoft data center, which Microsoft has already announced a pause to. 



1100 MW gas plant 
https://apps.psc.wi.gov/ERF/ERF/comment/filecomment.aspx?util=6630&case=CE



Methane storage facility 
https://apps.psc.wi.gov/ERF/ERF/comment/filecomment.aspx?util=6630&case=CG&num=140



That is especially burdensome considering the risk that these plants may become stranded assets. We Energies, the most profitable utility in Wisconsin, is still collecting about $650 million from plants which won't produce any power. These became a stranded asset and left customers on the hook for rising electricity rates. Imagine moving out of a house and being stuck with the mortgage for another 15 years. WE Energies has requested significant rate hikes for 2025 and 2026. The total requested increase for electricity bills is $418.8 million over two years (methane gas is almost 200 million on top of this), which translates to an 18.5% increase for residential customers. Of course, us residential customers have been footing more of the increases than the commercial customers. 

 The health costs alone associated with these impacts are estimated to be around $120 million dollars, annually. Southeastern Wisconsin, including Milwaukee and Kenosha counties, already struggles with air quality issues. The new plant would worsen these conditions, leading to more emergency room visits and health problems. For some reason, the Public Service Commision has allowed for no environmental study be done on the proposed plant, even though they required it for other less polluting plants proposed in the state. 
",70,28,2025-04-07 09:21:55,1jtmfk2,https://www.reddit.com/gallery/1jtmfk2,milwaukee,restaurant_mention
Oak Barrel Public House,nitro cold brew,pilcrow is always my go-to for fun nitros. are there other places in milwaukee that do nitro cold brew with flavors?,1,8,2025-01-28 11:49:41,1ic7h42,https://www.reddit.com/r/milwaukee/comments/1ic7h42/nitro_cold_brew/,milwaukee,restaurant_mention
Mediterranean cuisine,Thoughts on Mediterranean Cuisine Milwaukee? Planning a get-together.,"Hey! I'm planning a little get-together with some of my high school friends, probably around 8 to 10 of us, and we’re thinking about going to Mediterranean Cuisine in Milwaukee. I haven’t been there myself, so I was wondering if anyone here has tried it and could share their thoughts. Is it a good spot for a group? How’s the food overall? I’ve heard the kebabs and gyro are popular, but I’m open to other suggestions too. We’re mostly looking for a chill place with good food and decent service. Do they have enough space to handle a group that size comfortably? And is it better to go at a certain time to avoid a wait? Any tips or recommendations would be super helpful. Thanks in advance!",1,22,2025-06-19 16:00:45,1lflxn3,https://www.reddit.com/r/milwaukee/comments/1lflxn3/thoughts_on_mediterranean_cuisine_milwaukee/,milwaukee,restaurant_mention
Swingin' Door Exchange,Great restaurants,Newer to the city and the girlfriends birthday is coming up. Was looking for the locals favorite restaurants to go to on a special occasion. She doesn't want super super fancy. ,0,38,2025-08-22 12:34:49,1mxcyai,https://www.reddit.com/r/milwaukee/comments/1mxcyai/great_restaurants/,milwaukee,restaurant_mention
Swingin' Door Exchange,Visiting soon for a Sunday funday,"Hi there, boyfriend and I are coming to Milwaukee on a sunday, staying near the public market, and leaving Monday.  We plan on having some cocktails and are looking for suggestions. Here's what we have so far...

Lunch at the public market 
Tour of the pabst mansion 
Stopping into safehouse and swingin door exchange for cocktails

We are looking for walkable dinner suggestions, places to pop in for a drink (we love a good dive bar!), and any other activities in the area we might not be aware of.  

Thanks in advance!!",0,5,2025-10-15 18:09:23,1o7q94d,https://www.reddit.com/r/milwaukee/comments/1o7q94d/visiting_soon_for_a_sunday_funday/,milwaukee,restaurant_mention
Swingin' Door Exchange,Labor Day weekend,"Hello from Kansas City. My partner and I coming up Labor Day weekend for the Deftones at FiServe Forum. Staying at a hotel downtown. Looking for some suggestions on spots to hit for dinner, brunch, late night dinner after the show. Any cool, interesting neighborhoods we should explore? 

Going to be a short visit as we also hitting the show Friday night in Minneapolis then probably dropping down to Chicago for a stop there too. Anyways, tell me what you all got! Thanks friends.",0,3,2025-08-05 08:11:25,1mi8t2z,https://www.reddit.com/r/milwaukee/comments/1mi8t2z/labor_day_weekend/,milwaukee,restaurant_mention
Swingin' Door Exchange,Restaurant/Bar for out of town coworkers ,"I have some coworkers coming in for a few days. Any restaurants or bars to recommend taking them to? They’re staying downtown so preferably something around there, maybe Brady St area? Nothing upscale but not dive bar or Kopps either. ",0,11,2025-01-15 06:47:05,1i1wm3u,https://www.reddit.com/r/milwaukee/comments/1i1wm3u/restaurantbar_for_out_of_town_coworkers/,milwaukee,restaurant_mention
Swingin' Door Exchange,What’s your favorite hidden gem date spot (on a budget),"Hey guys,
Me and my girlfriend (22) are getting sick of our same ole date night spots and wanna make a list of new places to add to the list! What are some of your hidden gems??

Thanks in advance!!",51,70,2025-04-02 20:59:17,1jq6dlf,https://www.reddit.com/r/milwaukee/comments/1jq6dlf/whats_your_favorite_hidden_gem_date_spot_on_a/,milwaukee,restaurant_mention
Swingin' Door Exchange,Amazing city!,"Just wanted to shout out Milwaukee for an incredible long weekend! We brought Amtrak from SW Michigan and spent four days in your fair city. It was so much fun!! Just met such incredible people, enjoyed the library, Public Museum, Public Market, and had really nice food/drinks at Swingin Door and Sports Club. Enjoyed checking out the Pfister and having a cocktail at Mason Street Grill. Our stay at Drury on Water Street was really top notch! Had really fun, nice, SAFE, Lyft drivers…it was overall just a really wonderful weekend! We will be back again for sure! Thanks Milwaukee!!! ",190,11,2025-09-29 14:03:37,1ntquao,https://www.reddit.com/r/milwaukee/comments/1ntquao/amazing_city/,milwaukee,restaurant_mention
Swingin' Door Exchange,Recommendations,"In town for a conference and I’m looking for some restaurant recommendations that show what Milwaukee has to offer.

Not looking for super fancy smancy, but more like somewhere you would take your parents that are coming in from out of town.

Edit: any recommendations around the Milwaukee Public Market area would be appreciated.",0,39,2025-06-11 19:14:23,1l98ilg,https://www.reddit.com/r/milwaukee/comments/1l98ilg/recommendations/,milwaukee,restaurant_mention
Swingin' Door Exchange,good chicken caesar salads?,Im on the hunt for a GOOD chicken caesar salad in mke. I know there is better food in mke but can’t help my cravings. ,13,38,2025-03-17 19:43:29,1jdsq96,https://www.reddit.com/r/milwaukee/comments/1jdsq96/good_chicken_caesar_salads/,milwaukee,restaurant_mention
Swingin' Door Exchange,"In Milwaukee for the weekend, where should we eat / drink?",My fiancée and I are moving to Milwaukee next month and we are coming up for the weekend to check out apartments. What are some must eat restaurants/bars that we shouldn’t miss out on to make the most of trip? We would like to eat at mostly affordable places but will have one dinner at somewhere that can be pricier. Open to any suggestions!!,0,25,2025-05-01 19:55:07,1kcok3e,https://www.reddit.com/r/milwaukee/comments/1kcok3e/in_milwaukee_for_the_weekend_where_should_we_eat/,milwaukee,restaurant_mention
Swingin' Door Exchange,"Visiting for event, need thoughts on safety","Hello! I am going to an event at the Baird center and am staying at the Hilton Garden Inn a half mile away. I was hoping to walk to the event, but was unsure if it was a safe area to walk at night. Also, are there places to eat between the two spots that you'd recommend? Thanks!",1,5,2025-10-02 22:44:06,1nwos5b,https://www.reddit.com/r/milwaukee/comments/1nwos5b/visiting_for_event_need_thoughts_on_safety/,milwaukee,restaurant_mention
Swingin' Door Exchange,Lunch spots,"Have a friend coming to visit for the day. What are some good lunch spots? (Brady, Lower East Side, Third Ward)",0,13,2025-07-15 14:43:25,1m0rnes,https://www.reddit.com/r/milwaukee/comments/1m0rnes/lunch_spots/,milwaukee,restaurant_mention
Swingin' Door Exchange,Uncle Wolfie's and the Wolf confusion?,"Hi Milwaukee humans,  
We're going to be in town later this week (with an 8-year-old) and are kind of confused about the 600 N. Broadway location of this place, which calls itself ""Uncle Wolfie's and the Wolf""? They both look good, but the Uncle Wolfie's menu seems a lot more accessible for the 8-year-old kid than the Wolf's - and we're not sure if the Wolf is really a kid-friendly kind of place.

Anyway, it's impossible to tell from their website what the deal is with it being two places? Is it Uncle Wolfie's for breakfast and lunch and then the Wolf for dinner, or two places next to each other, or...?

Thanks! (If you've got any other great nearby recs that are kid-friendly, especially for dinner, would love to hear them. Current potentials list in the immediate area is Zarletti, Buckley's, the Swingin' Door.)",14,30,2025-01-20 10:32:38,1i5u8up,https://www.reddit.com/r/milwaukee/comments/1i5u8up/uncle_wolfies_and_the_wolf_confusion/,milwaukee,restaurant_mention
Swingin' Door Exchange,Best lunch spot downtown,"I’m a Milwaukee girl who no longer lives there and is visiting this weekend. It’s been too long, so I don’t know what’s good! What’s the best spot for lunch downtown these days? ",0,10,2025-07-30 16:21:56,1mdiwgn,https://www.reddit.com/r/milwaukee/comments/1mdiwgn/best_lunch_spot_downtown/,milwaukee,restaurant_mention
Swingin' Door Exchange,Restaurant nearish to the MKE art museum,"coming to Milwaukee tomorrow for the Art in Bloom show at MAM and looking for recommendations for a lunch restaurant nearby – Ish that is kid friendly and mid-level (not super expensive or fancy). 

",1,12,2025-04-05 09:34:01,1js4sop,https://www.reddit.com/r/milwaukee/comments/1js4sop/restaurant_nearish_to_the_mke_art_museum/,milwaukee,restaurant_mention
Swingin' Door Exchange,Places to go,I’m gonna be in Milwaukee soon for a concert and was wondering if there’s any cool places to visit/shop? Me and my mom are very excited to visit :),0,5,2025-06-05 12:26:50,1l4541e,https://www.reddit.com/r/milwaukee/comments/1l4541e/places_to_go/,milwaukee,restaurant_mention
Swingin' Door Exchange,Places to eat,I'll be in town starting Wednesday through the weekend for Adepticon. I was wondering what are some of the best places I have to check out for food.,0,9,2025-03-23 10:41:24,1ji23qj,https://www.reddit.com/r/milwaukee/comments/1ji23qj/places_to_eat/,milwaukee,restaurant_mention
Swingin' Door Exchange,Recent Review Thursday,"## Welcome to our weekly review thread!


This thread is meant to be a place for the community to share reviews of local places they've recently visited or patronized, be it a good experience or bad. Please only share reviews for recent experiences as establishments are subject to change. Pure conjecture or allegations will not be allowed as this is meant to be a place to share actual experiences.",3,1,2025-06-05 06:00:45,1l3wb9m,https://www.reddit.com/r/milwaukee/comments/1l3wb9m/recent_review_thursday/,milwaukee,restaurant_mention
Swingin' Door Exchange,Patty melt,Can someone please help me with a good patty melt place in mke I seen five guys had one but I don’t see it on their menu,1,2,2025-03-29 17:36:25,1jmy5ur,https://www.reddit.com/r/milwaukee/comments/1jmy5ur/patty_melt/,milwaukee,restaurant_mention
Birch,Lunch,"Where should my husband I head to lunch today? We are kid free for several hours and we always default to the same places (tiki bar, hungry sumo, Camino) which are all so delish, but want something different. Thanks!!! 🦭🤠",25,100,2025-11-01 09:21:22,1olp1n6,https://www.reddit.com/r/milwaukee/comments/1olp1n6/lunch/,milwaukee,restaurant_mention
Birch,Can't miss restaurant,"Hi, if you're in Milwaukee for one night, what's the restaurant that you absolutely have to visit and why? We like almost all cuisines but don't have $200 per plate to drop ",63,121,2025-07-13 23:27:21,1lzd4hp,https://www.reddit.com/r/milwaukee/comments/1lzd4hp/cant_miss_restaurant/,milwaukee,restaurant_mention
Birch,WTMJ4 suing the St. Francis school board under open records law for their refual to allow an open meeting to be filmed.,Good grief - why on earth would anyone in public service make such an unforced error? Glad this lady didn't become state superintendent. ,322,38,2025-06-05 07:12:16,1l3xm52,https://www.tmj4.com/news/milwaukee-county/tmj4-pursues-legal-action-after-st-francis-superintendent-blocks-reporter-from-filming-public-meeting,milwaukee,restaurant_mention
Birch,elegant/upscale restaurant recs,"Hi everyone! It's my boyfriend's birthday this week and I want to take him out for a nice dinner on Saturday, the budget im hoping for is less than $200 per person, but I'm open to whatever really! I would've liked to take him to Ca Luccenzo because he took me on a date there once and it was one of our favorite dates, but it was already reserved for that whole day. I'm hoping to find something similar food and vibe wise, I'm also taking him to a candlelight concert thing later that day and I plan on wearing this so I'm trying to find something that I can wear this to so we wouldn't have to go back home to change. Thank you in advance :)",0,12,2025-11-23 22:05:14,1p57815,https://www.reddit.com/gallery/1p57815,milwaukee,restaurant_mention
Birch,"Me and a friend are coming into town to watch Mumford & sons, where should we grab dinner?","I like the title states, me and a buddy are going to the Pfizer forum tonight to watch Mumford & sons and we're going to be arriving in the city around 3:00 p.m. 

Where can we find either some snacks and eventually dinner? Originally my plan was just to go to the public market but I thought I should ask some locals first

EDIT:  I should have clarified we're college students so we don't have a whole lot of money, so nothing like a smokehouse or really high-end restaurant, I think the maximum would probably be willing to spend is something similar to safe house or AJ bombers",0,18,2025-10-11 13:02:23,1o42bq3,https://www.reddit.com/r/milwaukee/comments/1o42bq3/me_and_a_friend_are_coming_into_town_to_watch/,milwaukee,restaurant_mention
Birch,Restaurant Recommendations,"Any restaurant recommendations in the area from the Third Ward up to Whitefish Bay? My wife and I are looking for something new and are pretty adventurous when it comes to types of cuisine so long as it’s not spicy.

Thanks in advance!",0,17,2025-09-24 22:07:57,1npvzhp,https://www.reddit.com/r/milwaukee/comments/1npvzhp/restaurant_recommendations/,milwaukee,restaurant_mention
Birch,40th Birthday in Milwaukee,"I love Milwaukee and want to spend my 40th birthday there and introduce some friends to this great city. Was thinking of renting an AirBNB in Walker's Point. Below is the tentative itinerary - let me know if there's anything you would change! 

**Friday Lunch:**   
**Friday night:** cocktail somewhere (maybe The Mothership?)   
**Friday dinner:** 5 O'clock steakhouse (want them to get a supper club experience, but don't want to travel too far)  
**Friday night:** someplace to dance to 2000 - 2010s music (suggestions welcome!)  

**Saturday brunch:** Uncle Wolfies (we'll drag ourselves up early to get a spot or send someone to put our names on the list)   
**Saturday:** bar hopping / college football watching / sightseeing (maybe some place walkable so we could see the beautiful city between bars - open to suggestions here!)   
**Saturday night:** Dinner at Birch or any other nicer spot   
  
**Sunday**: Bagels from Ruby's and head home (some of us may try to catch an early NFL game)  ",0,24,2025-08-06 11:29:52,1mj9e83,https://www.reddit.com/r/milwaukee/comments/1mj9e83/40th_birthday_in_milwaukee/,milwaukee,restaurant_mention
Birch,Cassis Opening,"Does anyone know when the French restaurant at 333 Water, Cassis, will be opening? It looks like they are finally starting to make progress inside. No info is on their website or when I walk by. ",1,4,2025-11-12 18:05:02,1ovm1uz,https://www.reddit.com/r/milwaukee/comments/1ovm1uz/cassis_opening/,milwaukee,restaurant_mention
Birch,Upscale Restaurant Recommendations,"My fiancé and I are looking for a place to eat after we get married at the courthouse! We moved here less than a year ago and are looking for a nicer restaurant to go to. We are not picky eaters, and we especially love good seafood. ",0,28,2025-03-29 17:09:29,1jmxltt,https://www.reddit.com/r/milwaukee/comments/1jmxltt/upscale_restaurant_recommendations/,milwaukee,restaurant_mention
Birch,Date Night,Good restaurants for date night in or around Milwaukee? ,0,16,2025-06-25 13:24:28,1lkde9u,https://www.reddit.com/r/milwaukee/comments/1lkde9u/date_night/,milwaukee,restaurant_mention
Birch,Babette walk-in’s?,"Bavette!!   Damn autocorrect.  

Can we score bar seats without reservations?  Coming in two weeks to your pretty city and really hoping to check this joint.  ",0,7,2025-08-01 17:06:13,1mf9pz5,https://www.reddit.com/r/milwaukee/comments/1mf9pz5/babette_walkins/,milwaukee,restaurant_mention
Birch,Buffalo Chicken Quesadilla,I’m moving to Milwaukee this summer and need to find the best place to get a buffalo chicken quesadilla,0,10,2025-05-26 07:37:21,1kvtaju,https://www.reddit.com/r/milwaukee/comments/1kvtaju/buffalo_chicken_quesadilla/,milwaukee,restaurant_mention
Birch,Anniversary dinner,"What would you choose and why? Staying at the pfister.
Carnivore 
Carbon
Wards house of prime
Mason street grill",0,8,2025-01-29 13:45:24,1id2oo8,https://www.reddit.com/r/milwaukee/comments/1id2oo8/anniversary_dinner/,milwaukee,restaurant_mention
Birch,Birthday dinner,"Hi,

Hubby and I will be in Milwaukee for his birthday on May 5th. I am searching for a restaurant that offers a tasting menu. I thought I found one at Birch but they are not open on Mondays. 

I have been looking on Open Table and Yelp but I thought I would ask the community for help. 

I would prefer to stay close to the Water Street area. 

Thank you as always. ",0,3,2025-03-22 12:40:27,1jhe0is,https://www.reddit.com/r/milwaukee/comments/1jhe0is/birthday_dinner/,milwaukee,restaurant_mention
Zarletti,best ITALIAN restaurant?,"Looking for the best spot within a 30 mile radius. Just looking to have a nice dinner with my wife on her bday.

What are your favorites? ",35,110,2025-11-12 10:22:21,1ov9neo,https://www.reddit.com/r/milwaukee/comments/1ov9neo/best_italian_restaurant/,milwaukee,restaurant_mention
Zarletti,Best food in milwaukee. Any sort of genre.,I'll be visiting soon and I'm a big food person. I tend to go for more ethnic stuff but some local greatness is also appreciated. I'm from Chicago so I have a plethora of amazing food in my disposal at all times so I really really need to be impressed. I'm not trying to like flex I've just been eating like a pig my whole life here. So only your top choices that you think would wow somebody from out of town,15,89,2025-03-01 16:34:33,1j1bqr6,https://www.reddit.com/r/milwaukee/comments/1j1bqr6/best_food_in_milwaukee_any_sort_of_genre/,milwaukee,restaurant_mention
Zarletti,What is your go to Italian pasta place?,"Update: Went to Carini's. It was bomb and close by. I can't wait to try Tenuta's next time we're down that way.  

I'm looking specifically for a place with a bomb alfredo. I only ever get a GOOD one when I make it myself and I don't feel like making it this time since I want it as a birthday meal out. I would rather go upscale than down. I'm not talking Olive Garden level pasta. I want the good stuff. ",29,84,2025-02-06 20:58:00,1ijl2l5,https://www.reddit.com/r/milwaukee/comments/1ijl2l5/what_is_your_go_to_italian_pasta_place/,milwaukee,restaurant_mention
Buckley's Restaurant & Bar,The Third Ward becomes Hollywood!,"This summer will be 35 years since the Third Ward was turned into the backdrop for DILLINGER, starring Mark Harmon. I shared a studio in the Marshall Building with 2 other illustrators at the time and we spent a lot of time watching the action. 320 E Buffalo was dressed up as the Biograph, and I remember watching the night they gunned down Mark Harmon in the street. A couple of scenes were shot at the Broadway Bar & Grill at 221 Broadway. I think it was the only restaurant in the Third Ward back then. There was also a big bank robbery scene shot in the ornate lobby on the Wisconsin Electric Power Co at 231 W Michigan. Here are some of the photos I shot that summer. You can still see the movie on YouTube, link below. Unfortunately it wasn't a very good movie, but the fun was just seeing Milwaukee in the background.

[https://youtu.be/Nzw5A4INF1Y?si=7xa6LEvRy4sjxYuL](https://youtu.be/Nzw5A4INF1Y?si=7xa6LEvRy4sjxYuL)",449,32,2025-06-08 11:38:35,1l6gimu,https://www.reddit.com/gallery/1l6gimu,milwaukee,restaurant_mention
Buckley's Restaurant & Bar,Restaurant,"Parents are flying into town and we are deciding between Goodkind, Morel, & Odd Duck. Anyone prefer one over the other? Never been but all the menus look good. ",1,27,2025-09-28 15:37:35,1nsyyxh,https://www.reddit.com/r/milwaukee/comments/1nsyyxh/restaurant/,milwaukee,restaurant_mention
The Wicked Hop,Two random Swedes are back home. Thank you Milwaukee!,"So. We are back home, jetlagged and happy.

Since you guys truly opened your subreddit, heart and city for us, we thought we'd give you some details about what actually happened to us. Did we get out on the water? Did we enjoy Milwaukee?

We flew in to Chicago and got to our rental car, which happened to be a brand new Jeep Wrangler. We've driven quite a lot in the States but holy cow are you Wisconsinites in a hurry. Driving 10 MPH over the speed limit and we were still always the slowest car on the road. Some butt clenching moments were had.

We had booked an AirBnb and stayed in The Malt House. A really cool apartment house full of Pabst history and Central Waters Brewery and OnTap right outside the door. It was dirt cheap for some reason. We paid about $90 per night for a 2 bed room apartment with all the bells and whistles. We had e few beers and our first Cheese Curds, which we loved, and took an early night.

The next day we walked around Milwaukee and happened to stroll right by BMO Pavilion as The Red Clay Strays did their sound check. It sounded awsome so when we got back to the AirBnb we listned some more as we'd never heard of them before. Took us one song to decide to book tickets.

At the concert we met so many wonderful people. In the row behind us were four of the most fantasic people we've ever met, it took them all about 10 seconds to proclaim ""We are going to take care of you guys"". And boy did they.. They took us to the Public Market Tikihut after the concert and the evening ended with dancing in The Wicked Hop until it closed. To top an amazing night off, they invited us to Kenosha to go out on the lake with their boat. We accepted without hesitation. Some time later we headed out to Kenosha and had an absolute blast on the waters. Live music, wake surfing, swimming. A day I will remember and cherrish til the day I die. We didn't fish, but we couldn't have cared less. This was way better than fishing.

This is pretty much how our trip carried on. Minus some days with runny noses and a couple of days with shopping.

Everyone thought we were crazy for coming to Milwaukee on vacation. We disagree. We love your city. Everyone was so warm and welcoming. Incredible hospitality. We have only positive things to say about our trip. We have made life long friends. You should feel proud.

Hoping you guys are okay eventhough you've had the rainfall of a century.

Thank you Milwaukee!",1137,54,2025-08-10 16:52:53,1mmv9sq,https://www.reddit.com/r/milwaukee/comments/1mmv9sq/two_random_swedes_are_back_home_thank_you/,milwaukee,restaurant_mention
The Wicked Hop,where to find a good caesar (drink)?,i’ve heard wicked hop had them in the past but don’t see it on the menu,0,7,2025-10-05 15:17:11,1nyyupq,https://www.reddit.com/r/milwaukee/comments/1nyyupq/where_to_find_a_good_caesar_drink/,milwaukee,restaurant_mention
The Capital Grille,Steak Au Poivre?,"Been craving steak au poivre (pepper steak) but the only places I know of offering this sauce are $50 and up for a steak (Carnevor, Capital Grill). Does anyone know of a restaurant in mke where I can satisfy my craving without breaking the bank?",0,6,2025-04-23 23:43:31,1k6ju2p,https://www.reddit.com/r/milwaukee/comments/1k6ju2p/steak_au_poivre/,milwaukee,restaurant_mention
Cavas,Most unique restaurants in Milwaukee,"What are some of the most unique restaurants in Milwaukee? Unique in any way— cuisine, vibe etc. I’m from Texas and love unique experiences with food. ",87,148,2025-12-09 07:58:33,1pi83mb,https://www.reddit.com/r/milwaukee/comments/1pi83mb/most_unique_restaurants_in_milwaukee/,milwaukee,restaurant_mention
