Restaurant/Topic,Title,Body,Score,Num_Comments,Created_UTC,ID,URL,Subreddit,Type
dinner,How much clothing do you have to remove to fly out of General Mitchell field?,"Hello everybody.

Looking for somebody with some experience on flying out of MKE.  

I haven't been on a plane in some years, but have a wedding to attend in florida and will be flying down.  

Spirit airlines has some rather stringent regulations on luggage, so I don't have much space, so I'm thinking I'll just wear on the plane what I'll wear to the rehersal dinner, bingo bango.  

Now that's just a jacket, vest, shirt, tie, pants.  This also helps me have an outer layer for the wisconsin cold without lugging my winter coat all the way down to sunny florida.  

Besides, I am about to be strapping my ass to an aluminum tube and hurdling through the air at 500 miles an hour in a feat inconcievable to almost every person who ever lived.  Might as well dress nice.  

So in the end I'm no more layered than your average business traveler in a suit.  

Question though - I have no real memory of what the security process is like.  Is having that much clothing going to cause a problem at security?  

What do y'all think?

",0,14,2025-12-04 11:20:29,1pe5uct,https://www.reddit.com/r/milwaukee/comments/1pe5uct/how_much_clothing_do_you_have_to_remove_to_fly/,milwaukee,general_food
dinner,Finding suitable thanksgiving orphans next year,"Years ago I moved out to California in October and that first Thanksgiving absolutely sucked. I didn't know a soul out there and I learned the meaning of loneliness.

Fast forward to this past weekend, my GF and I decided to pay it forward and host a couple of thanksgiving orphans for dinner next year. Here's the question, though. We want them to be complete strangers, but would also like to screen out sociopaths and people on the opposite end of the political spectrum. How would you go about finding suitable guests?",7,13,2025-12-01 09:39:40,1pbfzai,https://www.reddit.com/r/milwaukee/comments/1pbfzai/finding_suitable_thanksgiving_orphans_next_year/,milwaukee,general_food
dinner,Von Trier will be under new ownership,"I was at Von Trier last night and they announced they'll be transitioning to a new owner. With that, they'll be closing for around 3 weeks starting around mother's day for ""light renovations"". Since this new owner took over they changed up the menu, removing a majority of their options, very few German options. When I went last night I was fully planning on buying dinner, but $21 for a cheeseburger was insane.

I'm not posting just to complain but I hope these changes won't ruin a great bar/restaurant. Hopefully the menu was slimmed down in preparation for closing for renovations to avoid wasting food. But man, if they ruin the look of that place I doubt I'd want to go back",129,31,2025-04-18 09:36:14,1k26gg7,https://www.reddit.com/r/milwaukee/comments/1k26gg7/von_trier_will_be_under_new_ownership/,milwaukee,general_food
dinner,East Side Christmas  ,"Bob Dylan Complete Unknown at Downer Theater and dinner at Emperor of China on Brady St. 

Dylan movie was really great. Chalemet became Bob Dylan. Very impressed with his singing and portrayal. 

Emperor of China was busy but they had everything going like seasoned pro’s. Havent been able to enjoy Christmas there in 5 years. ",445,13,2024-12-26 08:28:15,1hmpeoq,https://www.reddit.com/gallery/1hmpeoq,milwaukee,general_food
dinner,Carnevor,"We are coming to visit next week for a quick trip from Chicago for a mid-week break.

I made reservations at Carnevor for a special date night. 

While I still have time to cancel, I’m wondering if it lives up to the hype I’ve seen online?

Thanks!",2,22,2025-09-29 16:02:46,1nttzm4,https://www.reddit.com/r/milwaukee/comments/1nttzm4/carnevor/,milwaukee,general_food
dinner,1033 Omakase Res available tomorrow 11/5,"I hate that I cannot attend since this reservation was sooo hard to get but I am unable to go to the restaurant tomorrow evening. I will be charged $60/person to cancel so I’m hoping someone in this group would be happy to go in my place. Otherwise I’ll call and beg for a favor 😫

I went once before and it was amazing!!! This LA transplant craves great sushi and this has been the only great sushi I’ve had since moving here. ",2,16,2025-11-04 08:32:22,1oo8onb,https://i.redd.it/n6y0z98s39zf1.jpeg,milwaukee,general_food
dinner,Wedding venues,"Hey all. My fiance and I are planning our wedding and unfortunately the venue we had initially thought would be a great fit, turned out to be less than what we were looking for. We are looking to do a pig roast/bbq style dinner and with our first venue falling through, were curious if any of you had positive experiences (wedding or non-wedding) with a space that could accommodate a less fancy, or non-all-inclusive, caterer?

Honestly considering any ideas/spaces that would accomodations upwards of 100 folks. Appreciate any advice.",0,19,2025-10-08 18:58:00,1o1rc8g,https://www.reddit.com/r/milwaukee/comments/1o1rc8g/wedding_venues/,milwaukee,general_food
dinner,41 North is an ice rink,"Be careful driving, I saw several cars struggle to get up little hills on the freeway and backends loose everywhere. Proceed with caution and stay home if you can. Today feels worse than yesterday ",133,37,2025-01-22 09:34:20,1i7dsmy,https://www.reddit.com/r/milwaukee/comments/1i7dsmy/41_north_is_an_ice_rink/,milwaukee,general_food
dinner,New Year’s Eve,"Help! I’m newly sober-ish (as in, not strictly sober, just not trying to be in clubs/bars all night), and I’m trying to find something to do with my wife in MKE proper on NYE. I’m open to something pre-fixe but would also prefer to not spend $150/pp which I know limits us. We’re also fine just going to a nicer dinner! We’re 32, and open to just about all types of food, I just want to do something different where the main focus isn’t blacking out. I was drinking heavily for a very long time so I’m kind of at a loss. Open to Tosa/Stallis/Whitefish Bay/etc. if we have to as well, but would like to *try* and stay in the city if we can as we live here. Thanks!",5,9,2025-12-05 14:50:47,1pf6b8k,https://www.reddit.com/r/milwaukee/comments/1pf6b8k/new_years_eve/,milwaukee,general_food
dinner,Things to do Saturday,"Concert we were heading to on Saturday got canceled due to the weather and our hotel is nonrefundable. What is there to do. Open to anything,shows dinner theatres, live music anything. ",0,31,2025-07-17 22:13:46,1m2rhtx,https://www.reddit.com/r/milwaukee/comments/1m2rhtx/things_to_do_saturday/,milwaukee,general_food
dinner,Community Resources & Ideas to Help People Losing SNAP Benefits,"I think as a community we should try and help our neighbors who may be losing SNAP benefits. I am also trying to brainstorm ideas that I can do to help. I know others have shared local food banks, but they're already are overwhelmed and will only get busier and potentially run out of food. Obviously if you can donate money or food to a shelter that is the one of the best things you can do right now. I recently became a volunteer at Hunger Task Force myself.

Below is a list of my ideas. Critique them if you please, but I am not here to judge those that need help. 

1. I think the timing up of this with Halloween means that if you are handing out Halloween candy, you should consider leaving out a donation bin of non perishable food/canned food and fruits & vegetables. This is a much more direct way of sending food to those that need it. I am an apartment dweller so this doesn't work for me. I can imagine some of the kids getting the candy might only have that to eat for the foreseeable future. We recently had several PNS grocery stores close done so there areas of MKE with food deserts. If kids are coming to your neighborhood for candy especially if you live in an area with limited grocery store options please consider this. 

2. I regularly eat at Sam's club cafeteria and they sell a $1.50 hotdog combo/$2 pizza meals similar to Costco. Aldi is also doing a $40 thanksgiving dinner. Most of them items are spices/canned food. Although I think it would be better just to donate $40 to a local food bank, this is also a potential option.

3. I know restaurant owners already have tight margins, but they should consider if people have SNAP to give them a discounted/free meal. McDonald's is doing their Monopoly game and a lot of the prizes have been free food. Although fast food isn't healthy nor cheap nowadays. Putting pressure on larger chains/franchises to do this is also something that can be done. It is good PR for them. 

If anyone has any other ideas in the comments please let me know. You can use this post as a way to share ideas and maybe help each other. If you are someone on SNAP and need assistance feel free to link up with people in the comments. My dm's are also open.",35,10,2025-10-28 10:55:18,1oid61e,https://www.reddit.com/r/milwaukee/comments/1oid61e/community_resources_ideas_to_help_people_losing/,milwaukee,general_food
dinner,Pay As You May Thanksgiving Meal,"**November 21 Deadline**



**Jen's Sweet Treats**



4745 S Packard Ave, Cudahy, WI 53110



[(414) 940-0725](https://www.google.com/search?q=jen%27s+sweet+treats&sca_esv=572b41ead329c329&sxsrf=AE3TifPJQ2-vyklkDchuTISRKjwRZv8p8g%3A1763237188688&source=hp&ei=RN0Yaai9Jpmu6-APo57ZoAE&iflsig=AOw8s4IAAAAAaRjrVOWJysP0d_2nudGhrP8Wsnz9AuTe&ved=0ahUKEwio76Gy-vSQAxUZ1xoGHSNPFhQQ4dUDCBo&uact=5&oq=jen%27s+sweet+treats&gs_lp=Egdnd3Mtd2l6IhJqZW4ncyBzd2VldCB0cmVhdHMyFBAuGIAEGJIDGMcBGMkDGI4FGK8BMgUQABiABDIFEAAYgAQyBhAAGBYYHjIGEAAYFhgeMgYQABgWGB4yBhAAGBYYHjIGEAAYFhgeMgYQABgWGB4yBhAAGBYYHkiAIFAAWMgccAB4AJABAJgB2AGgAc0NqgEGMTIuNS4xuAEDyAEA-AEBmAISoAKCDsICExAuGIAEGMcBGCcYigUYjgUYrwHCAhAQIxjwBRiABBgnGMkCGIoFwgIKECMYgAQYJxiKBcICCxAuGIAEGJECGIoFwgIOEC4YgAQYsQMYgwEYigXCAhEQABiABBixAxiDARiKBRiNBsICBRAuGIAEwgIREC4YgAQYsQMY0QMYgwEYxwHCAgQQIxgnwgIOEC4YgAQYkQIY1AIYigXCAhAQLhiABBhDGMcBGIoFGK8BwgIKEC4YgAQYQxiKBcICCxAuGIAEGLEDGIMBwgILEAAYgAQYkQIYigXCAg0QLhiABBixAxhDGIoFwgIKEAAYgAQYQxiKBcICEBAuGIAEGLEDGEMYgwEYigXCAg4QLhiABBjHARiOBRivAcICCxAuGIAEGMcBGK8BwgIHEAAYgAQYCpgDAJIHBjEyLjUuMaAHlP4BsgcGMTIuNS4xuAeCDsIHBjAuMTYuMsgHJw&sclient=gws-wiz#)",67,2,2025-11-15 14:08:10,1oy1jga,https://i.redd.it/zpx3tjte9h1g1.jpeg,milwaukee,general_food
dinner,North Shore Burbs,"Hello people of Reddit. I will be relocating to the Milwaukee area with my husband and kiddo and we are looking at the north burbs based on schools and proximity to downtown. Apologies for the very ignorant question, but I have spent most of my life in cities (currently in Chicago) and so suburban living is new to me. How big of a lifestyle difference is Fox Point vs Whitefish Bay? I imagine we will be car dependent either way. What about city conveniences - Can I take an Uber to Milwaukee for dinner and drinks? Can I get food delivered? Any input is greatly appreciated! 

Edit: I am middle aged and lame. Looking for a home where it is possible to enjoy city-ish conveniences while still having enough space where I don’t hear my next door neighbor cough. ",0,46,2025-03-31 09:49:54,1jo4ztp,https://www.reddit.com/r/milwaukee/comments/1jo4ztp/north_shore_burbs/,milwaukee,general_food
dinner,So you've wanted to try curling?  Here's your chance.....,"So you've been mesmerized by watching curling on TV - the way the stones glide down the ice and then click and bump each other out. The strategy involved is pretty much chess on ice, with the added requirement to have the skill to send a 42 pound stone down the ice at a precise angle with the proper force for the shot called. And what is all that sweeping and yelling about?

The Racine Curling Club is holding Learn to Curl sessions Friday and Saturday, October 24th & 25th. You won't be ready for the Olympics afterwards, but we will teach you the basics. For those who face physical challenges who don't think they can squat down and throw out of the hack, we'll teach you an alternative delivery method using a ""stick"" that can be done standing up. It's also good exercise - you can really slay some calories by sweeping.

Our club members have competed in Canada, Scotland, Iceland, throughout Wisconsin and the US, and even over the Cheddar Curtain in Illinois against FIBS (whom we do welcome at our club, we have several who cross the border to play with us). We have some top level curlers in Racine, but we're friendly and don't bite - we were all beginners at one point. Curling is also a very social sport - after each match, we sit around the table with munchies and beverages and solve some of the world's problems. One of our ""social"" leagues features a potluck dinner. Curlers are some of the friendliest people around.

Come on out and give it a try - [click here to sign up - slots are limited.](https://racinecurlingclub.com/try-curling/learn-to-curl/) You'll get to see our ice house that was renovated in the summer of 2024 with a new and improved ice sheet.",36,9,2025-10-23 11:53:48,1oe8kya,https://www.reddit.com/r/milwaukee/comments/1oe8kya/so_youve_wanted_to_try_curling_heres_your_chance/,milwaukee,general_food
dinner,High end hotel suggestions?,"We're planning a quick getaway ina couple months to celebrate not having cancer (yay!) and we're going to be in town for two nights. Last time we were in town we stayed at the Pfister. 

I like the vibes and the atmosphere, but I'm of the understanding that they're doing some updating right now and I'm unsure where specifically and if I want to deal with construction on site, and for the price of the property, the lack of a decent mini fridge/microwave in this year 2025 rubs me the wrong way. 

Are there other high end but classic and beautiful hotels nearby I should be looking into? Still looking to be downtown, but interested in suggestions. Our dinner plans are Carnevor and if at all possible we prefer to walk/use street car.

Thanks for any and all suggestions!",18,50,2025-01-16 16:31:59,1i31b9g,https://www.reddit.com/r/milwaukee/comments/1i31b9g/high_end_hotel_suggestions/,milwaukee,general_food
dinner,Best bars for group near Walkers Point/Third Ward,"Will be going out for dinner with friends in the Third Ward and wondering what some of the best nearby bars are for a group of people. Was thinking outsider (may be too cold), CAMP bar or Pomeroy (haven’t been but looks like the vibe we are hoping for. Wondering if anyone has suggestions?",0,9,2025-11-07 11:59:01,1or1e9y,https://www.reddit.com/r/milwaukee/comments/1or1e9y/best_bars_for_group_near_walkers_pointthird_ward/,milwaukee,general_food
lunch,What was your favorite MPS hot lunch?,"For all my old MPS mates, (mainly ones who attended in the late 90s to mid 00s) what was your favorite hot lunch? I know MPS isn't really known for their food, but there were a couple bangers.

Am I the only one who remebers the chop suey? Last time I had that was 2002 or so. Guessing that one got axed from the menu rotation do to popularity but that slapped. That was my favorite next to the mock chicken legs.",80,124,2025-09-02 09:05:42,1n6kf67,https://www.reddit.com/r/milwaukee/comments/1n6kf67/what_was_your_favorite_mps_hot_lunch/,milwaukee,general_food
lunch,Best lunch in the city?,My friend and I are coming up from Indiana and staying in the dells. One day we are going over to Milwaukee and getting some lunch/shopping. What’s hands down the best lunch? We are open to anything. ,43,74,2025-08-31 11:34:59,1n4zb7x,https://www.reddit.com/r/milwaukee/comments/1n4zb7x/best_lunch_in_the_city/,milwaukee,general_food
lunch,“Milwaukee Toast” on Austrian Lunch Menu,"As a Milwaukee native living abroad, I thought the sub might get a kick out of the double take I did while out to lunch in St. Pölten, Austria (about 50 miles west of Vienna). 

For those who don’t speak German — are you really from Milwaukee if you don’t speak German?! — the entree consists of toasted sourdough with grilled sirloin, slaw, onion, a fried egg, BBQ sauce, and a side of steak fries. 

Regardless of the fact that I’ve never seen this on a menu in Milwaukee, it sure was nice to see my hometown in print. 

Prost!!",357,32,2025-03-25 09:51:50,1jjl6z8,https://i.redd.it/qti93f23nuqe1.jpeg,milwaukee,general_food
lunch,What’s your local sandwich place to check out for Saturday Lunch?,"Wife and I will be driving thru on a Saturday and gotta stop for lunch.  Usually we find a brewpub but lately we’ve been on a kick of finding small local sandwich shops that have just good old fashion cold cut sandwiches.  Anything in Milwaukee worth stopping for?  I know being from Chicago (Go Cubs) we have lot of variety, would love to see what you guys have to offer ",14,65,2025-07-14 06:37:24,1lzk2j8,https://www.reddit.com/r/milwaukee/comments/1lzk2j8/whats_your_local_sandwich_place_to_check_out_for/,milwaukee,general_food
lunch,Lunch on the Lake,"Hi all.  I’m in town for ten days visiting mother in law.  She’s a spry and “with it” lady of 85.  I would love to take her to lunch on the waterfront, however not being from here, I thought I would come here for advice.  Are there nice places to have lunch?  How hard is it to get there?  She lives in Franklin.  

I appreciate your help and look forward to hearing from you.  ",28,43,2025-08-07 14:11:14,1mk92z2,https://www.reddit.com/r/milwaukee/comments/1mk92z2/lunch_on_the_lake/,milwaukee,general_food
lunch,The Mekong Cafe lunch buffet...,"I just saw on their website that the lunch buffet is back.  This was my favorite lunch spot, the buffet was crazy good.  Posting for awareness in case you, like me, love to go crazy on midday beef larb and crab rangoon!  I cannot wait to go back.",133,17,2025-05-09 13:19:34,1kipfsr,https://www.reddit.com/r/milwaukee/comments/1kipfsr/the_mekong_cafe_lunch_buffet/,milwaukee,general_food
lunch,Need lunch suggestions,My family and I drive around the country visiting MLB ballparks and will be in Milwaukee the afternoon of June 24 for a Brewer’s game. Looking for a place for Lunch. Hitting Leon’s for frozen custard but need a spot that provides a traditional Milwaukee cuisine. Go! ,0,28,2025-06-15 07:14:46,1lbywya,https://www.reddit.com/r/milwaukee/comments/1lbywya/need_lunch_suggestions/,milwaukee,general_food
lunch,New to me spots for a late lunch,"Guys, I want to try something new (to me) today. The problem is, I’m kind of a picky eater & I am not in the mood for anything bougie. I just want a chill pace to have some sense of comfort food & a couple of beers w/ my husband today. Tired of going to the same places all the time. ",2,37,2025-03-01 11:12:56,1j14dy5,https://www.reddit.com/r/milwaukee/comments/1j14dy5/new_to_me_spots_for_a_late_lunch/,milwaukee,general_food
lunch,Lunch on Monday?,"
Lunch ideas for Monday? My brothers are coming to town and we’re getting together for lunch tomorrow. I thought we’d do Zocalo, a fun Milwaukee spot, especially on a beautiful day but they’re closed on Mondays😞
What ideas do you have?",0,20,2025-07-06 17:35:49,1lte4m4,https://www.reddit.com/r/milwaukee/comments/1lte4m4/lunch_on_monday/,milwaukee,general_food
lunch,Good Quick Lunch,Some work friends and I are looking for some good places for lunch. We work near Potawatomi and we only have 30 minutes for lunch. Take out is preferred over dine in.,0,13,2025-07-24 08:27:49,1m84f56,https://www.reddit.com/r/milwaukee/comments/1m84f56/good_quick_lunch/,milwaukee,general_food
lunch,Lunch ideas for a craft beer snob,"Hey everyone, will be going up to 3 Sheep’s brewery end of July for their members party.  Driving up from Chicago (go Cubs) and will probably be in the area around lunch time and would like some recommendations for a strong beer and good food.  Looking for something dank, not bland bar food, and a well assortment of beer.  If anyone has any suggestions, it would be greatly appreciated.  ",0,13,2025-06-16 07:26:47,1lcrgxb,https://www.reddit.com/r/milwaukee/comments/1lcrgxb/lunch_ideas_for_a_craft_beer_snob/,milwaukee,general_food
lunch,Does Dan Dan still do their lunch buffet on Fridays?,Looking online and I dont see anything confirming that it's still there. Has anyone gone recently?,0,12,2025-06-06 10:31:39,1l4vd4d,https://www.reddit.com/r/milwaukee/comments/1l4vd4d/does_dan_dan_still_do_their_lunch_buffet_on/,milwaukee,general_food
lunch,Nice lunch recommendations?,"My fiancée and I are doing a courthouse wedding in Waukesha (no weddings in MKE unfortunately) and are looking for a nice place to eat lunch with a small group after. Can either be in Waukesha or Milwaukee (or anywhere in between). Most of our normal places don’t quite feel up to the occasion, so any recommendations are appreciated!",0,11,2025-04-28 11:57:06,1ka0i7g,https://www.reddit.com/r/milwaukee/comments/1ka0i7g/nice_lunch_recommendations/,milwaukee,general_food
lunch,Special holiday lunch?,"Hello -

I am looking for a place to meet some friends for lunch on Monday with a lot of holiday decor.  One person may be bringing a 7 and 9 year old. 

Ideas?

Thanks!",0,1,2024-12-19 22:13:52,1hibll3,https://www.reddit.com/r/milwaukee/comments/1hibll3/special_holiday_lunch/,milwaukee,general_food
lunch,Public Market negative review alert - DAA BBQ,"Maybe it’s a cursed stall at the Public Market, or maybe it’s just bad barbecue, but I tried David Alan Alan’s Smokehouse for lunch a short time ago and it was awful. The meat was flavorless (I had a brisket sandwich) and the sauce had a sharp, almost metallic taste. About a week ago I was talking to a friend who mentioned they just had some of the worst bbq ever at DAAs in the Public Market. Wanting to give it the benefit of the doubt I tried again yesterday and it was again just… awful. Flavorless meat and the sauce had that same flavor. The market was jumping as usual on a Saturday but DAAs was relatively quiet. I’d say bring back the soup place lol but is that stall just cursed?",100,103,2025-10-26 09:01:23,1ogldge,https://www.reddit.com/r/milwaukee/comments/1ogldge/public_market_negative_review_alert_daa_bbq/,milwaukee,general_food
lunch,Anyone else in mke having low energy since late August?,"I went to see lcd soundsystem at the rave on august 16. It was a huge crowd and I felt terrible for a few days after that. Since then, I’ve had low energy every day. I’m in my forties and pretty fit with a good diet and generally I feel good. However, since late August I just lack energy. I’m not sleepy-tired just feel worn out. I often get 9 or 10 hours of sleep and it changes nothing. 

My wife was with me at the show and she has the same issue as me.  Today I had lunch with a coworker who is 30 and he was complaining of low energy since the beginning of September. Same issue. 

I have no idea what’s going on. I thought it was maybe allergies but that should have passed by now. My only other thought is that maybe I caught Covid at the show and now I have some odd form of long Covid? 

Anybody else having low energy?",98,86,2025-10-29 15:19:22,1ojff2x,https://www.reddit.com/r/milwaukee/comments/1ojff2x/anyone_else_in_mke_having_low_energy_since_late/,milwaukee,general_food
lunch,Milwaukee Co Jury duty craziness,"Are any recent jurors struggling to process their time served? I’m having a hard time adjusting after a week servicing on a homicide case. It’s all so surreal… it almost felt like an episode of Squid Game when you show up and are anxiously waiting for your name to be called only to be assigned a number and be herded like cattle to the court room.

Everyone always jokes about “ways to get outta it” but the judge was making you eat out of their hands to cut down on people making BS excuses. For example they asked if anyone dislikes guns and multiple people raised their hands, followed up by questions like “do you dislike guns SO much that you wouldn’t be able to put your feelings and beliefs aside to act as a non biased juror in this case?”. It’s very clear that getting people to commit is becoming a larger and larger issue.

The case was really uncomfortable with obvious images of gun violence and gut wrenching testimonies and big attitudes between prosecutors. But what I found more disturbing was how Milwaukee Co let’s family members mingle around the juror room on lunch break and even outside of the courthouse after you’re dismissed. It doesn’t feel like there was much regard for safety or an attempt to keep us out of the way. 

My biggest issue was when the defense and state dismissed us and we started our deliberations only to find that they gave us ONE (1) copy of the juror instructions which included the laws we were to follow. I did a bit of research and this is becoming more uncommon. Think about it: 12 people, ONE packet containing all of the guidelines for how to go about deciding on a verdict. It was insanely irresponsible in my opinion and as the person that ended up reading the packer we could have done so many things wrong if I didn’t take the time to read through it all. Example: We took an initial vote to figure out where we stood and didn’t even differentiate between guilty for 1st degree (life) or 2nd degree (25 years). People couldn’t follow simple directions like only taking 5 mins to speak your turn and even started throwing personal attacks.

It was clear everyone wanted to leave on Thursday and didn’t want to put in the time to stay another day (Friday) to further debate if self defense was justified. It was a gross feeling that I can’t kick. 

",138,59,2025-10-20 07:31:52,1obhs24,https://www.reddit.com/r/milwaukee/comments/1obhs24/milwaukee_co_jury_duty_craziness/,milwaukee,general_food
