Restaurant/Topic,Title,Body,Score,Num_Comments,Created_UTC,ID,URL,Subreddit,Type
cafe,Buffets???,"Hi Milwaukee I’m tryna eat at a buffet today. The go to is Maharahja, but is there anything else I should know about? Any impressive Chinese buffets? I feel like buffets are dying out. No Golden Corral please.",39,72,2025-02-02 08:27:01,1ifybo3,https://www.reddit.com/r/milwaukee/comments/1ifybo3/buffets/,milwaukee,general_food
cafe,What was this? Bay View storefronts,"To all my Bay View historians - what used to be here at these lil tiny stores from left all the way down and what are they doing now?

They seem to have been vacant for as long as I remember and seem to be a cool spot for someone to open something up! The inside of these seem to be gutted, abandoned and collecting dust.

Location: S Kinnickinnic & S Howell  
Thank you!",128,44,2025-03-18 11:49:30,1je9kwy,https://i.redd.it/koi020ob8hpe1.jpeg,milwaukee,general_food
cafe,Where are the Zines…..,"Where can I find some fun and/or underground zines to show my middle school students!?!

I’m running a comic book and magazine club for 6-8th graders Monday and Wednesday mornings at my school.

I know Fuel Cafe used to have some back in the day, but I would also love tips on any zines coming out of Black and Hispanic communities…

Want to inspire my kiddos to create something that shows off the things that they love in the world!

",36,22,2025-10-13 09:39:59,1o5lje6,https://www.reddit.com/r/milwaukee/comments/1o5lje6/where_are_the_zines/,milwaukee,general_food
cafe,Starbucks not at Southridge Mall anymore??,"I went to the mall today and I found out that Starbucks was gone and then there is a new cafe called Milano’s Café D’ORO. It has been open since August 2025. 

Does anyone know why Starbucks is no longer there? Couldn't find any news on why it was gone. I was just in shock because it had been there for a long time. I know it's kinda related to the closures of the Starbucks cafe stores but idk. ",0,24,2025-10-04 22:18:58,1nydhmp,https://www.reddit.com/r/milwaukee/comments/1nydhmp/starbucks_not_at_southridge_mall_anymore/,milwaukee,general_food
cafe,Support the Milwaukee LGBT Community Center!,"The Milwaukee LGBT Community Center has served as a lifeline for LGBTQ+ individuals across Southeast Wisconsin for over two decades. Over the last several months, the Milwaukee LGBT Community Center has lost over $900,000 in federal funding. We face an urgent need to stabilize our operations and ensure our doors remain open to those who rely on us for safety, support, and empowerment.

We are launching our most ambitious fundraising campaign yet, and we need YOU.

Donate with the link provided, or share to spread the word.

",69,3,2025-12-07 18:45:01,1pgymuj,https://secure.everyaction.com/MZ9IqyUmMU6xIQJwwYDscw2,milwaukee,general_food
cafe,What are the Hidden Gems/Must-Visit Spots in Riverwest?,"My husband and I are moving to Riverwest, specifically near Clarke and Weil/Humboldt. We are not new to the city. We currently live on the north side, so we aren't totally unfamiliar but we don't know much about Riverwest. I'm wondering what the hidden gems in the area are, cool hangout spots, best bars and restaurants, biking/hiking trails, best places to go grocery shopping, cool hole-in-the-wall shops, upcoming events, etc. Also places to avoid. Looking on Google Maps, I see we are near the Falcon bowling alley and the Riverwest co-op grocery, if anyone can tell me about those places as well. Thanks!

Edit: Thank you to everyone who has commented so far! You guys have given us so many places and things to check out, and helped solidify that we made a good choice with this place 😄",15,31,2025-07-12 06:10:19,1lxxw07,https://www.reddit.com/r/milwaukee/comments/1lxxw07/what_are_the_hidden_gemsmustvisit_spots_in/,milwaukee,general_food
cafe,Resturants serving Barria Tacos,Any recommendations for Milwaukee restaurants that serve Barria Tacos with a Barria consome sauce?,16,40,2025-05-02 21:15:37,1kdi8pw,https://www.reddit.com/r/milwaukee/comments/1kdi8pw/resturants_serving_barria_tacos/,milwaukee,general_food
cafe,Favorite place to work with breakfast and coffee?,Hi! I've been down in the dumps lately. So I wanted to get out of my house and see if that would help with my motivation. Favorite places to work from?,28,29,2025-06-06 08:12:30,1l4s2g0,https://www.reddit.com/r/milwaukee/comments/1l4s2g0/favorite_place_to_work_with_breakfast_and_coffee/,milwaukee,general_food
cafe,Best coffee spot for a first date?,"I live outside of Milwaukee and don’t travel downtown much, but I’m going to plan a first date with someone I met online. I don’t drink so I was thinking of coffee instead, even though it will be after work. I want a modern place, with maybe somewhere to walk around nearby. If you have other suggestions I’d love to hear them! I also don’t drink coffee but I can suck it down for the sake of the date",5,21,2025-08-11 15:16:46,1mnnw7i,https://www.reddit.com/r/milwaukee/comments/1mnnw7i/best_coffee_spot_for_a_first_date/,milwaukee,general_food
cafe,Looking for open jams in Milwaukee,"I want to know what places and what days have open jams or open mic.  I'm a 42 year old bedroom guitarist that wants to go out and play again.  I live in southern Milwaukee area.  South side, Greenfield-ish.  Close to South Gate mall. I play mostly rock.  Love blues, alternative, heavy, chill, reggae, jazz. Sure I know about Bremans and others Northeast, but I don't have a car.  I want to go somewhere closer.  Message me about places you have played at yourself even.  Rock on. ",6,14,2025-09-17 13:09:23,1njkohx,https://www.reddit.com/r/milwaukee/comments/1njkohx/looking_for_open_jams_in_milwaukee/,milwaukee,general_food
cafe,Looking for friends,"Hello, everyone! 

My name's Tommy, born and raised near St. Louis, MO. I moved from St. Louis, MO to Milwaukee, WI a few weeks ago since I accepted a job here. 

I'm Lao and Chinese. During my free time, I enjoy writing, exploring parks, learning languages, playing/watching Yu-Gi-Oh!, checking out Lao restaurants and Buddhist temples, and going to the theaters to see Bollywood and Hong Kong/Cantonese movies. 

I don't have many friends around my age (late 20s/early 30s) in Milwaukee, so I'd love to make some friends here!

Thank you!",35,15,2025-08-13 18:11:09,1mpju5h,https://www.reddit.com/r/milwaukee/comments/1mpju5h/looking_for_friends/,milwaukee,general_food
pizza,Part II: Update on Pizza in MKE,"After the initial post of “Update on Pizza in MKE” with a photo of Wy’East Pizza declaring it the best pizza in Milwaukee, I asked y’all to share your favorites and created a list. Last Friday, I went and grabbed Hup’s for the first time after I received several recs to check it out. And I was not disappointed. Amazing thin crust and love the owners. Appreciate your recommendations and I’ll update more moving forward.

P.S. Also, I was in Green Bay this week and I got Cranky Pat’s which had awesome cracker style thin crust with beautiful leoparding char on the bottom. Highly recommend if you’re in GB. 

",109,113,2025-08-22 16:33:49,1mxj58o,https://i.redd.it/ft2fmdyi3nkf1.jpeg,milwaukee,general_food
pizza,"In honor of the new Pope being from Chicago, what is the best Chicago-Style Deep Dish Pizza in Milwaukee?","Inspired by a post I saw that said ""Finally Rome will have good pizza""

A new Pope has been selected!

The first American Pope in history, from Chicago, Illinois.

[https://en.wikipedia.org/wiki/Pope\_Leo\_XIV](https://en.wikipedia.org/wiki/Pope_Leo_XIV)

Cardinal Robert Francis Prevost, now known as Pope Leo XIV (that's Pope Leo the 14th).",149,131,2025-05-08 13:00:11,1khwoty,https://www.reddit.com/r/milwaukee/comments/1khwoty/in_honor_of_the_new_pope_being_from_chicago_what/,milwaukee,general_food
pizza,Sad day for Pizza in Milwaukee,"Anodyne Pizza: [https://www.jsonline.com/story/entertainment/dining/2025/02/25/anodyne-coffee-roasting-co-milwaukee-shutters-bay-view-pizza-operations/80319657007/?tbref=hp](https://www.jsonline.com/story/entertainment/dining/2025/02/25/anodyne-coffee-roasting-co-milwaukee-shutters-bay-view-pizza-operations/80319657007/?tbref=hp)

Lou Malnatis: [https://www.jsonline.com/story/communities/south/2025/02/25/three-wisconsin-lou-malnatis-pizzeria-locations-have-closed/80256238007/?tbref=hp](https://www.jsonline.com/story/communities/south/2025/02/25/three-wisconsin-lou-malnatis-pizzeria-locations-have-closed/80256238007/?tbref=hp)

Edit to make clear there’s two different articles. 
",125,112,2025-02-25 20:39:56,1iyd6tl,https://www.reddit.com/r/milwaukee/comments/1iyd6tl/sad_day_for_pizza_in_milwaukee/,milwaukee,general_food
pizza,What's going on at Pizza Shuttle in the mornings?,"Frequently, there are folks hanging around Pizza Shuttle in the mornings before it opens. Sadly, the people appear to be strung out, have mental health issues, are unhoused, or a combination of the three. It's sad to see. Any idea what's going on here?",54,72,2025-08-21 08:44:06,1mwbbyg,https://www.reddit.com/r/milwaukee/comments/1mwbbyg/whats_going_on_at_pizza_shuttle_in_the_mornings/,milwaukee,general_food
pizza,Pizza Recommendation,"Hello Reddit, I moved to Milwaukee last fall and I have no damn idea where to get decent pizza around here. What are y'all's best places? 

Prefer to stay away from chains... Thanks in advance! 

Not the purpose of the post, but Lou Malnatis is a very funny name. ",1,111,2025-04-05 08:52:59,1js3y2z,https://www.reddit.com/r/milwaukee/comments/1js3y2z/pizza_recommendation/,milwaukee,general_food
pizza,Riverwest Pizza was so good,"needed a new go-to after the changes at Lisa’s. although it was perhaps on the small side for an 18-incher, perfect crust and broil ",115,32,2025-05-14 20:35:12,1kmwa70,https://i.redd.it/gntjr4kfnu0f1.jpeg,milwaukee,general_food
pizza,White Pizza,"Looking for white pizza, seems the only way to get it is go to MOD and create your own? 

Otherwise I haven’t seen it anywhere in town. Does anyone know of a place that has it? 

I ate it a lot in DC, and sad that I cannot find it out here as tomato sauce is difficult for me to digest. 

I look forward to trying any suggestion!! ",8,46,2025-04-30 17:40:55,1kbtksz,https://www.reddit.com/r/milwaukee/comments/1kbtksz/white_pizza/,milwaukee,general_food
pizza,BLT pizza,Is there anywhere in or near Milwaukee that has blt pizza? ,1,19,2025-10-02 16:50:23,1nwh6ss,https://www.reddit.com/r/milwaukee/comments/1nwh6ss/blt_pizza/,milwaukee,general_food
pizza,BEST CRISPY PIZZA,"Hi all, I’m on the hunt for Milwaukees best crispy pizza. Think New York slice. Think Dave Portorny style. Crispy, little to no flop, not overly greasy. Despite my best efforts I haven’t yet found a clear winner but I have found some odd hidden gems. If you have a pizza place that you think would score highly on Dave’s scale, please put it in the comments. 

Example Pizza I’m looking for: https://www.instagram.com/reel/DFBN0deyhlh/?igsh=a2E1cXMycTRpdjk=

Honorable Mentions
1) Glorioso’s - Weirdly enough, gloriosos, the grocery store, makes a pretty good, flavorful, and crispy pizza.
2) Classic Slice - For me this pizza is reliable but not what I’m searching for. Too much flop, not enough flavor. 
3) Flour Girl and Flame - SOOOO flavorful and yummy, but doesn’t have the crunch factor.
4) Papa Luigi’s - Good pizza to order on a night in. Not the correct style of pizza. Greesy. Lot of flop. Good flavor. Crunch like a cracker but this isn’t the right type of crunch I’m looking for. 

Edit: I agree w/ comments. Not a Dave P fan but figured it would be a good discriptor for pizza people. ",0,53,2025-01-26 17:07:23,1iataqg,https://www.reddit.com/r/milwaukee/comments/1iataqg/best_crispy_pizza/,milwaukee,general_food
pizza,Pizza question,"Where can you get pizza by the slice other than Ian’s, Pizza Shuttle, Classic Slice, and Rocky Rococo?",6,49,2025-01-13 23:42:10,1i0z8rs,https://www.reddit.com/r/milwaukee/comments/1i0z8rs/pizza_question/,milwaukee,general_food
pizza,BLOCK PARTY THIS WEEKEND! bands! pizza! outdoor gear! vintage! art! DOGS! community orgs! mending! coffee! climbing! skincare! cameras! bikes! boards! pie! raffle! neighbors!,"Come be in community!

Grab a friend, or make some new ones🤙 Let's dance and eat and explore and support our little businesses and the cool shit they're doing to make our city connected and ALIVE. 

MAKE PARTY, MILWAUKEE ",92,20,2025-05-01 09:59:32,1kcato9,https://i.redd.it/uur8nao6q6ye1.jpeg,milwaukee,general_food
pizza,Pizza By The Slice,"I’m trying to find an answer to Pizza-By-The-Slice (beyond Ian’s), and I’m struggling. Any suggestions from Milwaukee most knowledgeable locals?",6,46,2025-01-05 00:25:10,1htziyo,https://www.reddit.com/r/milwaukee/comments/1htziyo/pizza_by_the_slice/,milwaukee,general_food
pizza,Lalicata s pizza,Anyone remember lalicatas pizza on the south side here in Milwaukee in the 80s and 90s. Their pizza used to get these bubbles by the crust that were so good. It really was the best. ,6,8,2025-10-10 04:41:34,1o2wftb,https://www.reddit.com/r/milwaukee/comments/1o2wftb/lalicata_s_pizza/,milwaukee,general_food
pizza,Thanksgiving pizza,Need recommendations for good local places open tonight. Preferably in the bayview area ,0,2,2025-11-27 20:01:22,1p8izk4,https://www.reddit.com/r/milwaukee/comments/1p8izk4/thanksgiving_pizza/,milwaukee,general_food
pizza,Help finding pizza place I had in the past,It must have been 2014-2015 when I had this pizza. I think it was closer to north side of Milwaukee or Wauwatosa area. I think it was cash only and they had a pickup window on the street as well as a bar next door or part of it. I really can’t remember. It came wrapped in paper bag not cardboard box. Might have been cracker crust but can’t say for sure. Any ideas on what place this could have been? Thanks for the help,22,17,2025-07-03 12:16:47,1lqv7tt,https://www.reddit.com/r/milwaukee/comments/1lqv7tt/help_finding_pizza_place_i_had_in_the_past/,milwaukee,general_food
pizza,High School Project Ian's Pizza Pricing Survey,"Hello! I am a high school student trying to complete a project about finding the best price to charge for a slice of Mac and Cheese pizza from Ian's. I could use any pizza eater's help in taking my survey and providing input on this project!

The survey should take 1 minute or less and consists of 2 questions.

Link:

[https://docs.google.com/forms/d/1Cp\_gWkcVHcouEIjl236eOBwtQlcqupceyMWiZf3Aaa0/viewform?edit\_requested=true](https://docs.google.com/forms/d/1Cp_gWkcVHcouEIjl236eOBwtQlcqupceyMWiZf3Aaa0/viewform?edit_requested=true)

Thank you for reading and for considering!

Have great day!",52,14,2025-01-09 14:27:26,1hxmcv2,https://www.reddit.com/r/milwaukee/comments/1hxmcv2/high_school_project_ians_pizza_pricing_survey/,milwaukee,general_food
pizza,Pizza on Christmas eve,I wanna order pizza in Brookfield but I don’t wanna order dominos or big chain pizza if I don’t have to. Do you know what is open Christmas Eve?,0,21,2024-12-23 16:22:03,1hkz00u,https://www.reddit.com/r/milwaukee/comments/1hkz00u/pizza_on_christmas_eve/,milwaukee,general_food
pizza,Double Decker Pizza,"Does anyone know of any pizza places in Milwaukee area that offer Double Decker pizza? Not sure how common it is but it’s different than Chicago style/stuffed pizza. This is like two thin crusts on top of one another but baked together. 

Willing to travel out to the suburbs but the closest I know of is in IL. ",2,7,2025-05-15 10:07:02,1knajy3,https://www.reddit.com/r/milwaukee/comments/1knajy3/double_decker_pizza/,milwaukee,general_food
pizza,Pizza recs ,"Bringing my Montana raised boyfriend home to Milwaukee for the first time.
He's never had Detroit style or Chicago style pizza. Giving him his options, and we'll choose a place from there.
Who has your favorite of either?

I grew up near Hups, and they're my favorite basic pizza local spot. But he needs to culture himself with new pizza varieties.


(I'm not only feeding him pizza, we're here for a week and we'll be doing all sorts of shit)",0,18,2025-01-05 16:13:25,1huix3x,https://www.reddit.com/r/milwaukee/comments/1huix3x/pizza_recs/,milwaukee,general_food
pizza,"Moving from Menomonee Falls to WFB/Shorewood for a ""walkable"" childhood? Is this realistic?","My family is considering a move from the Menomonee Falls/Sussex area to Whitefish Bay or Shorewood, and I'm looking for a reality check. We know the trade-off would be getting a smaller home than we have now  and likely more in property taxes, but we're trying to prioritize a different lifestyle.

I have two kids (9 and 6). We currently live in a land-locked subdivision where nothing is walkable. It feels very insular. It seems like all the kids in our area are overscheduled, and there’s almost no spontaneous play. If kids get together, it's always a pre-arranged ""play date."" On top of that, lots of people in our neighborhood send their kids to private schools, so the shared public school experience that was the ""glue"" for kids in my neighborhood growing up doesn't exist to the same extent here.

My biggest concern is that I feel like kids build self-confidence by learning to do age-appropriate things independently. The version of independence I had as a kid just doesn't seem possible here.

I admit I'm nostalgic for my own upbringing. I could walk home from school. As I got older, I could ride my bike to parks, the public pool, and even a diner to get a burger with friends. We had friends in the neighborhood we could just go hang out with.

My main question is: **Am I being nostalgic for a** ***time*** **(the 90s) or a** ***place?***

For those of you living in Whitefish Bay or Shorewood:

* Do kids actually walk or ride bikes to school?
* Do you see groups of kids (say, 9-12 year olds) on bikes heading to the park, the library, or to grab a slice of pizza on their own?
* Is ""just playing outside"" with neighborhood friends still a thing, or is everything as scheduled as it is out here?

I'm trying to figure out if I'm chasing something that doesn't exist anymore, or if that kind of neighborhood-centric, independent childhood is still possible in those communities.

Appreciate any insights.",128,215,2025-10-24 08:01:44,1oex4rq,https://www.reddit.com/r/milwaukee/comments/1oex4rq/moving_from_menomonee_falls_to_wfbshorewood_for_a/,milwaukee,general_food
pizza,Italian Easter Ham Pie/Pizza Rustica,"Anyone know of any place that makes and sells these.

I've checked Gloriosos in the past and they didn't but wondering if anyone knows a place that might.",1,0,2025-03-10 08:51:14,1j7z2ju,https://www.reddit.com/r/milwaukee/comments/1j7z2ju/italian_easter_ham_piepizza_rustica/,milwaukee,general_food
pizza,Riverwest Pizza,"I’m blown away nobody has recommended this pizza. 

So good. Consistently too. I’ve had it maybe four times the past couple weeks. Now, maybe not the fastest but the large cheese for 13 bucks? How can you beat that?

Really, really, delicious.",1,0,2024-12-22 18:08:20,1hkbet5,https://www.reddit.com/r/milwaukee/comments/1hkbet5/riverwest_pizza/,milwaukee,general_food
pizza,This flood is way worse than the 2010 flood,"I don't know how many MKE ogs are on the subreddit but in the earlier hours this was eerily similar (imo) to the July 2010 flood that caused a bunch of damage here. Then I saw the videos from State Fair, yeah this one's gonna be historic.",357,88,2025-08-10 03:45:23,1mmdhxp,https://www.reddit.com/r/milwaukee/comments/1mmdhxp/this_flood_is_way_worse_than_the_2010_flood/,milwaukee,general_food
pizza,Boston to MKE,"Hi all,

I am thinking of moving from my job's office in Boston over to Milwaukee, and am curious about the day to day life of you fine midwesterners. I really enjoyed a trip out to the MKE office when I visited earlier this year, but was stunned by how empty the city felt at night compared to Boston.

I have lived in Massachusetts my whole life and am looking for a change, but truthfully a big reason for me as well is that the cost of living in Boston is just too much to bear, even with a good job like mine. It is impossible to get an affordable studio or one bedroom and I don't want 5 roommates anymore lol. I want to know what sort of fun stuff there is to do in Milwaukee, great places to make friends, and just generally what you all love about this state and city.

Any advice is appreciated! :)

  
EDIT: Thanks for all the advice! As advertised, you guys are very nice and thoughtful. If you see a redhead in a red sox jacket in the next year, say hi! (Even if you hate the sox lol) ",18,122,2025-11-05 10:12:52,1op72sz,https://www.reddit.com/r/milwaukee/comments/1op72sz/boston_to_mke/,milwaukee,general_food
pizza,Urban planning,Holy parking Batman! Are we really still developing like this? Taking a looking at the St. Francis triangle project map and blown away at the crazy amount of space allotted to cars. 564 spaces? The west side of the lot completely devoid of activity outside a potential dental office?! Crazy. ,102,99,2025-08-26 13:03:28,1n0t4km,https://i.redd.it/bgp124hnlelf1.jpeg,milwaukee,general_food
pizza,Why is the commercial real estate around UWM so cursed?,"There have been at least 6 restaurants on the northwest corner of Oakland and Locust since 2017. The Black Rose and Monster Pizza closed and the spot lay empty for 5 years, then got filled by another pizza place for maybe less than a year before they closed too. It took something like 3 years to get one more tenant on the bottom floor of The East Sider apartment, and it's a BWWs. I'm not sure if that giant place on Downer that I think used to be a bookstore is filled yet. Halal Guys closed with almost no notice during the pandemic. There's that GW's that closed last month.

I would think that a restaurant or coffee shop near a large university campus would be an easy slam dunk of a business.",115,139,2025-03-15 18:37:59,1jc8ait,https://www.reddit.com/r/milwaukee/comments/1jc8ait/why_is_the_commercial_real_estate_around_uwm_so/,milwaukee,general_food
pizza,Milwaukee is showing up for Sade Robinson,"SO MANY HONKS downtown outside the Maxwell Anderson trial. If you drove by and gave honks, joined in, showed support- Thank you 🩷🩷🩷

Trial continues Monday morning.  Sade deserves justice. 

If you can, support Sade's Voice foundation (QR code in pics) here: https://sadesvoicefoundation.com/

Community is what makes Milwaukee great. One of ours was brutalized, countless people subjected to pain and devastation, body parts washing up on our beaches. Show your support foe Sade Robinson. Spread the word.  Demand justice! 

🩷",398,45,2025-05-31 11:03:11,1l00lfi,https://www.reddit.com/gallery/1l00lfi,milwaukee,general_food
pizza,Say what you will about Gruber Law…,"I take issue with the amount of waste companies like Gruber Law create with their heavily focused local marketing but hot damn, these pizza slicers are always legit…

",152,64,2025-08-14 11:39:10,1mq5sqk,https://i.redd.it/so882gtnj0jf1.jpeg,milwaukee,general_food
pizza,"Upper East Side Residents, thoughts? ",Received this in the mail from development company trying to build 7-story residential building on 2560 N Stowell Avenue. Personally have no objection as that lot has been vacant without any land use for a  while. It isn’t even utilized for parking. What are your thoughts fellow East Siders?  I’ve attached the street view for reference. ,95,120,2024-12-31 16:39:11,1hqpt69,https://www.reddit.com/gallery/1hqpt69,milwaukee,general_food
pizza,Is this even legal?,Drove to Milwaukee to try Fixture Pizza. Parked in the private lot next door and used the scanner on my phone to pay for parking. Apparently it didn't go through because I got a notice in the mail from Hollywood FL with pics of my license plates wanting $70 if I pay within the next 7 days or it's going to collections. No phone number to talk to anyone. $70!!!!,61,73,2025-02-03 14:16:17,1igyrrv,https://www.reddit.com/r/milwaukee/comments/1igyrrv/is_this_even_legal/,milwaukee,general_food
pizza,Anyone remember a room you could crawl into at Chuck E Cheese in the 90s,Anyone remember going to Chuck E Cheese in the 90s as a kid and there were cut out kid size doorways that you could crawl through in the stage room and crawl around in? I can’t tell if this is a real memory or not! ,98,45,2025-05-18 12:40:20,1kppnxl,https://www.reddit.com/r/milwaukee/comments/1kppnxl/anyone_remember_a_room_you_could_crawl_into_at/,milwaukee,general_food
pizza,Good local salad places?,"I’m a sucker for a salad, Panera is my go to with all their new salads but I’d love to support something local. Any suggestions? Open to greek, ceaser, mediterranean, southwest, etc.",5,38,2025-08-01 14:41:23,1mf65ny,https://www.reddit.com/r/milwaukee/comments/1mf65ny/good_local_salad_places/,milwaukee,general_food
pizza,Best meal to get at the Third Street Market Hall,Looking to get the most bang for my buck combined with good flavor and ingredients.,23,78,2024-12-12 14:45:28,1hcuvmc,https://www.reddit.com/r/milwaukee/comments/1hcuvmc/best_meal_to_get_at_the_third_street_market_hall/,milwaukee,general_food
