Restaurant/Topic,Title,Body,Score,Num_Comments,Created_UTC,ID,URL,Subreddit,Type
East Town Kitchen + Bar,The Milwaukee brewing industry has broken my heart.,"Hey all. If you've ever been to a brewery in Milwaukee there's a good chance I've poured you a beer. My most recent job was Triple Taproom and Kitchen (aka Hacienda, also 3 Sheeps involved) on the east side. Today, I(along with the rest of the staff) received a message from the ""director of operations"" that we were closed permanently, effective immediately.

Unfortunately this is not the first place in Milwaukee I've worked that has closed. Not all as a blindside to employees, but nonetheless... I worked at Milwaukee Brewing Company when they closed. I worked at Mobcraft when they closed their doors. I worked at Fuel Cafe when they blindsided their employees(not a brewery, I know).  I've worked at Broken Bat, Gathering Place, and Central Waters (I was fired from there for questioning a manager illegally stealing tips from employees).

I'll say that I am a huge beer fan and honestly moved to Milwaukee due to it's reputation as an amazing beer city with rich beer culture. I had previously worked in downtown San Diego at an amazing little brewery, along with my Australian husband (who currently works at a Milwaukee brewery who has honestly treated him very well).

The main reason I'm posting this is due to the multiple blindsides from places who couldn't care less about their employees livelihoods, I am unable to connect with bar guests who I've come to know and love over my years in the industry in Milwaukee. If you know me, I'm the girl with braids, who probably cares too much, about beer, and her customers, and is absolutely heartbroken about all the connections I've had that I have no way to reach out to after the abrupt endings at so many beloved breweries I've worked at over my 4.5 years in Milwaukee. I would love to hear from you all! Cheers!",740,238,2025-08-04 21:26:48,1mhx8hw,https://www.reddit.com/r/milwaukee/comments/1mhx8hw/the_milwaukee_brewing_industry_has_broken_my_heart/,milwaukee,restaurant_mention
East Town Kitchen + Bar,Historic streams and current flood risk map,"I’ve created a map using zillow’s flood risk hazard layer and a historic streams map from the Original Plat Maps of the Wisconsin Public Land Surveys in 1835-1837. Keep in mind that old surveys may not line up exactly with modern streams. Most of us know about FEMA floodplains and the existing rivers in MKE county but there’s more than meets the eye. 

Unfortunately there’s a disconnect between our built environment and the land we’re occupying. MMSD is an incredible provider of infrastructure and flood control but it’s simply not enough to counter historic rains on top of historic marshes, swamps, wetlands, and streams. Both pieces of data are public through Zillow (flood risk) and MMSD (historic streams); If you are looking at buying a home make sure to understand your flood risk beyond FEMA zones!
",285,23,2025-08-12 15:44:30,1mokfey,https://i.redd.it/oh3k845mhnif1.jpeg,milwaukee,restaurant_mention
East Town Kitchen + Bar,Spicy Food in Milwaukee?,"Intensity over flavor.

Which Milwaukee restaurants have at least one spicy dish on the menu that will make even the strongest among us break a sweat?

I’ve been doing a series since the end of 2023 of ordering the spiciest options I can find, specifically within the city of Milwaukee.

From A-Z, here’s where I’ve gone so far:
- China Gourmet (level 5 + chili oil)
- EE-Sane (level 25 … off menu limit)*
- Emperor of China (hot + spicy … ’make it spicy’ requested)
- Hot Dish Pantry (nashville hot fried pork tenderloin sammy)
- Immy’s African Cuisine (smoked jerk chicken)
- Jack’s American Pub (dragon sauce)**
- Lucky Ginger (dragon’s breath)
- Lucky Liu’s (szechwan chicken)
- Paloma’s (demon s*men)
- Pepperpot Jamaican Cuisine (jerk chicken rice bowl and spicy wings)
- Pho 414 in Hmong Town (extreme fire with 5 spicy scoops)*
- Room Service (level 3)
- Sticky Rice (very hot sauce w/ volcano chicken)
- Thai A Kitchen (level 4 red curry)
- TODD ‘I Believe I Can Fry’ (szechuan spice/dry rub and mango habanero sauce)

There were a few others that weren’t spicy to me, so I didn’t add them to the series.

*Spiciest is a three-way tie between EE-Sane (most think level 10 is the max, off menu they go to level 25), Pho 414 in Hmong Town, and Jack’s American Pub.

**Jack’s American Pub’s dragon sauce wings were the biggest surprise for me, I didn’t expect them to bring the heat.",33,39,2025-08-11 18:14:45,1mnsfhk,https://www.reddit.com/r/milwaukee/comments/1mnsfhk/spicy_food_in_milwaukee/,milwaukee,restaurant_mention
East Town Kitchen + Bar,Best Fried Chicken Sandwich,Hey guys. One shot. Best chicken sandwich in Milwaukee. ,12,42,2025-08-06 17:20:37,1mjilye,https://www.reddit.com/r/milwaukee/comments/1mjilye/best_fried_chicken_sandwich/,milwaukee,restaurant_mention
Onesto,A mildly specific restaurant search,"My husband and I have had a real weird year (including becoming parents) and are celebrating our 10th anniversary in the beginning of September. We want to do something out of our usual “Goodkind as a nic(er) dinner” habit. 

What are your recommendations for a dinner in that sweet spot of “yes we’re celebrating but let’s not get carried away here”?",27,52,2025-08-25 20:11:15,1n08h2p,https://www.reddit.com/r/milwaukee/comments/1n08h2p/a_mildly_specific_restaurant_search/,milwaukee,restaurant_mention
Onesto,Where is this? (3rd Ward alley),"I’ve seen this setting used in portraits, and I’m pretty sure it’s in the 3rd Ward. Anyone know the specific location and street address? I found the photo online and would love to know the location. 

(The center of the photo is blurry because I removed the person being photographed.)",15,20,2025-10-27 14:17:47,1ohnoua,https://i.redd.it/2i2b2aeffpxf1.jpeg,milwaukee,restaurant_mention
Onesto,<$50 pp restaurant?,"Hello party people of Milwaukee. I’ve been snooping this sub for a bit and I am excited to be coming to your city for the first time. 
I realize that it’ll be busy with the brewers doing the way they are -congrats! 

As the title states I am looking for a place with ~$100 budget for two that’s nice for dinner. We like good food more than we like fancy food and though I realize there is some overlap there. 
I am also looking for something that’s not bar-centric since I’ll be getting plenty of burgers, wings, pizza, cheese curds, beer in my visit to Wi. And to my partners preference no Thai places for us ☹️ 

Staying in Third Ward like every other visitor but I’ll have a rental car. 

Edit: for anyone like me who searches old threads. I went to Momo mee twice during my time there. I had made reservations for onesto and also for la Merenda but my gf was really digging the xiao long bao. We actually also stopped there for lunch on our way out. 
The fish market and salad bar were good at the market. Hit up club giralbaldi for smoked wings. It was fine. Not something I’d go hunting for but a great place to watch some football. 
I also went to tin window bc at random and Bryant’s were closed. I didn’t dislike it but not something I’d go back for.  ",2,17,2025-10-14 21:38:14,1o6zdrl,https://www.reddit.com/r/milwaukee/comments/1o6zdrl/50_pp_restaurant/,milwaukee,restaurant_mention
Onesto,Wicked Popup,"My mom's 66th birthday is this weekend and we plan to go see Wicked. I'm looking for something to make the day a bit more special than simply seeing the movie. 

Has anyone been to the Wicked Popup? [https://onestomke.com/oz#EventDetails](https://onestomke.com/oz#EventDetails) . Was it worth it for $35/ticket? I'm a bit nervous it's going to just be loud and crowded. We're looking for a good time over a good instagram opportunity. 

What about dinner at Onesto? Would you recommend it, especially for a birthday dinner? 

Any other suggestions for making a birthday a bit more special with a VERY lose theme of Wicked? ",5,4,2025-11-26 09:59:31,1p7bewc,https://www.reddit.com/r/milwaukee/comments/1p7bewc/wicked_popup/,milwaukee,restaurant_mention
Onesto,"Best food in MKE, just moved here.","I’ll break it up into categories 
Bar food (burgers & wings) , Italian, Sushi, Hibachi, Indian, Chinese, middle eastern and then just anything else you recommend. 
For Asian I’ve been to dan dan and room service. Both looking for something more authentic. 
Best burger I’ve had was at Pete’s pub so far, looking for more suggestions and places. 
Been to onesto and saffron- want something less touristy  and cheaper. 
Mediterranean cuisine is one of my fav places but like to branch out and try more options . ",0,22,2025-07-08 15:05:45,1luyt4t,https://www.reddit.com/r/milwaukee/comments/1luyt4t/best_food_in_mke_just_moved_here/,milwaukee,restaurant_mention
Onesto,Cacio e Pepe over a cheese wheel?,Is there a place in Milwaukee that prepares Cacio e Pepe over a cheese wheel?,0,4,2025-11-07 19:53:45,1ord0ty,https://www.reddit.com/r/milwaukee/comments/1ord0ty/cacio_e_pepe_over_a_cheese_wheel/,milwaukee,restaurant_mention
Onesto,Italian restaurant wedding space,My best friend is getting married in the fall and they’re in search of Italian restaurants that can be rented out for their wedding reception. They’re thinking 30 or so guests. Any leads that I should have her look into?,2,4,2025-03-03 13:55:58,1j2rr0m,https://www.reddit.com/r/milwaukee/comments/1j2rr0m/italian_restaurant_wedding_space/,milwaukee,restaurant_mention
La Caribeña The best Caribbean family restaurant,One Place to Eat in Milwaukee,"I have one day in Milwaukee for a work trip and need a recommendation for the best restaurant to go to. Throw me your best places to eat!

UPDATE: So it's down to La Marenda or Movida… I want to try something unique and delicious. Plus a $50 meal for 1 is fine with me. Which would you suggest?",36,85,2025-04-12 23:02:48,1jxz6bf,https://www.reddit.com/r/milwaukee/comments/1jxz6bf/one_place_to_eat_in_milwaukee/,milwaukee,restaurant_mention
La Caribeña The best Caribbean family restaurant,Need an absolute MUST TRY restaurant,"Hey guys. I’m visiting from Chicago and looking for something that I absolutely must try. My family is huge on steaks/restaurants and we went to Carnevor and were kinda disappointed. 

Have reservations for Milwaukee Steakhouse tomorrow night, but after trying Carnevor worried that steaks here just won’t hold up to Chicago (not a diss on Milwaukee, Chicagos much bigger). 

So now we’re pivoting and looking for an absolute necessity, need to try, best place around, can’t get anywhere else, headline drawing restaurant. 

Where do we go?🙏

Update: Omg thanks so much everyone for all the responses. Such nice people and so many responses only an hr in. ❤️",0,78,2025-03-28 16:38:35,1jm6dyz,https://www.reddit.com/r/milwaukee/comments/1jm6dyz/need_an_absolute_must_try_restaurant/,milwaukee,restaurant_mention
La Caribeña The best Caribbean family restaurant,Shoutout to Taqueria el Cabrito,"If you love Mexican food like I do, do yourself a favor and go to Taqueria el Cabrito. It is, without a shred of doubt in my mind, the best Mexican food in the city. They are a small family run restaurant as well and all the servers are fantastic!

Support this awesome restaurant! ",69,17,2025-11-07 20:40:01,1ordz24,https://www.reddit.com/r/milwaukee/comments/1ordz24/shoutout_to_taqueria_el_cabrito/,milwaukee,restaurant_mention
La Caribeña The best Caribbean family restaurant,Best Cheese Curds in the Milwaukee Area,"TLDR: Give me recommendations for your favorite cheese curds from a dine-in restaurant 

Hey all, apologies for any weird formatting, I am on mobile.

My partner and I have family visiting from out of town. They were born and raised here, so whenever they come back to visit, they HAVE to have cheese curds.

We always meet them for dinner one night, and they always want us to pick the place. We try to find places that have great cheese curds, but also have good entrees as well.

Let us know your favorite dine-in restaurant with the best fried cheese curds! Anything in milwaukee or the surrounding area is perfect.

IMPORTANT NOTE: One of the family members is allergic to shellfish",3,35,2025-08-14 21:27:20,1mqkyxg,https://www.reddit.com/r/milwaukee/comments/1mqkyxg/best_cheese_curds_in_the_milwaukee_area/,milwaukee,restaurant_mention
La Caribeña The best Caribbean family restaurant,Are you struggling to find something to do this weekend? Here's your weekly roundup.,"Here are 5 of the best weekend events I could find in the Milwaukee area.

Get these as a weekly update: [https://brew-city-bulletin.beehiiv.com/subscribe](https://brew-city-bulletin.beehiiv.com/subscribe)

**Milwaukee Irish Fest** (Thursday 8/14 - Sunday 8/17) (Henry Maier Festival Park, 200 N Harbor Dr, Milwaukee) **KID FRIENDLY** The world's largest Irish music festival returns with over 100 acts across 18 stages of music, dance, and entertainment. This year's lineup features headliners like Cherish the Ladies, Skerryvore, Red Hot Chilli Pipers, and viral social media sensations the Gardiner Brothers making their U.S. debut. Kids can explore the Leprechaun Village, play mini golf, try crafts and games in the Children's Area, and meet Irish dog breeds in the Celtic Canine area. Children 12 and under get in free.

**~~Mi Gente Latin Beach Festival~~** ~~(Saturday 8/16, 10am-8pm) (Bradford Beach, 2400 N Lincoln Memorial Dr, Milwaukee) 18+ EVENT The Midwest's Ultimate Latin Beach Experience returns! This vibrant celebration of Latin culture brings music, dancing, food, and beach volleyball right to the sand. Gather your crew and enter the beach volleyball tournament for a shot at the $500 prize. Perfect for soaking up the lakefront vibes while experiencing authentic Latin culture and cuisine.~~  (Bradford Beach is closed until Sunday according to the City of Milwaukee)

**A La Carte at the Zoo** (Thursday 8/14 - Sunday 8/17) (Milwaukee County Zoo, 10001 W. Bluemound Rd, Milwaukee) **KID FRIENDLY** The Zoo comes alive with music, food, and fun for this annual tradition! Extended hours through the weekend (9:30am-9pm Thu-Sat, 9:30am-8pm Sun) let you explore the animals while enjoying great local food vendors and live entertainment. A perfect combo of family fun and foodie delights.

**MOWA Art & Chalk Fest** (Friday 8/16 & Saturday 8/17, 10am-5pm) (Museum of Wisconsin Art, 205 Veterans Ave, West Bend) **KID FRIENDLY** This free, two-day festival brings together artists from across Wisconsin for a weekend of live art and hands-on creativity. Chalk artists transform 10×10-foot squares of pavement into large-scale compositions, evolving from early outlines into finished pieces you can watch come to life. Great excuse to explore West Bend if you haven't been, plus it's completely free!

**Wicked** (LAST CHANCE!) (July 30 - August 17, Various Times) (Uihlein Hall, Marcus Center, 929 N. Water St, Milwaukee) **KID FRIENDLY** This Broadway sensation looks at what happened in the Land of Oz before Dorothy arrived. The tour runs through August 17, 2025, making this the final weekend to catch this wildly inventive story about the untold friendship between Elphaba (the future Wicked Witch of the West) and Glinda. Features post-show Q&As with cast members on select dates. A must-see if you haven't caught it yet - this is your last chance!",7,6,2025-08-14 18:51:54,1mqhhjd,https://www.reddit.com/r/milwaukee/comments/1mqhhjd/are_you_struggling_to_find_something_to_do_this/,milwaukee,restaurant_mention
La Caribeña The best Caribbean family restaurant,Support Shah Jees! ,"Shah Jees will be closing if they can’t raise enough money on their go fund me. I unfortunately can’t post the link due to community guidelines, but happy to send the link to those interested. 

Shah Jees has been a lunch time institution, and (arguably) some of the best food in the city. 

The original post from the go fund me site: 
“Hello Everyone,

I want to introduce you to my dad, the heart and soul behind Shah Jee’s, a beloved restaurant in the heart of Milwaukee, Wisconsin. My dad immigrated to this country in 1985, chasing the American Dream. He found that dream when he left behind his banking job in New York City and moved to Milwaukee to build a name of his own, starting with his passion for cooking. 30 years later, Shah Jee’s is a testament to his dedication and perseverance. For 30 years, he has poured his love, passion, and talent into this restaurant, creating a place where food is more than just a meal—it’s a connection, a memory, a taste of home.

My dad’s food is like no other. His flavors are unique, his service is unmatched, and to the countless loyal customers who have walked through our doors, Shah Jee’s is more than just a restaurant—it’s a family. Over the years, his hard work and devotion have earned Shah Jee’s the title of “The Gem of the City.”

Not only did my dad grow Shah Jee’s into a cherished spot in the community, but he also expanded, opening three more restaurants around the Milwaukee area. Unfortunately, like so many others, he faced unimaginable hardship when the pandemic hit. Despite his best efforts to keep prices affordable and service exceptional, the lockdown forced him to close all three new locations. This setback has deeply affected the business, and he’s been doing everything he can to keep the original downtown location open. But, it’s become harder each day, and my dad now fears that he may have to close his restaurant for good.

Shah Jee’s is more than just a business to my dad; it’s his pride, his joy, and the product of 30 years of tireless work. To see it slip away would break his heart and ours.

My dad is a man who has always given to others, quietly supporting and helping everyone around him. He’s a loving father, a selfless friend, and a respected pillar of the Milwaukee community. But asking for help? That’s not something he does. And so, we're asking for him.

If you can, please consider supporting Shah Jee’s in any way you can. Every donation will help my dad keep his dream alive—allowing him to continue doing what he loves most, while serving our community with the food and care he’s known for. Your support would mean the world to us.

Thank you, from the bottom of our hearts,
His loving daughters”",31,22,2024-12-17 15:55:46,1hglxs5,https://www.reddit.com/r/milwaukee/comments/1hglxs5/support_shah_jees/,milwaukee,restaurant_mention
La Caribeña The best Caribbean family restaurant,Are you struggling to find something to do this weekend? Here's your weekly roundup .,"Here are 5 of the best weekend events I could find in the Milwaukee area.

Get these as a weekly update: [https://brew-city-bulletin.beehiiv.com/subscribe](https://brew-city-bulletin.beehiiv.com/subscribe)

**MILWAUKEE**

Wisconsin State Fair | July 31 - August 10, 2025 | Daily | **Kid Friendly** 174 years of Wisconsin tradition featuring agriculture exhibits, carnival rides, live entertainment, and famous fair food. This 11-day celebration welcomes over one million visitors annually to celebrate Wisconsin's rich agricultural heritage and promising future. Family-friendly, affordable entertainment for all ages creating lasting memories and traditions. Don't miss the cream puffs! | Wisconsin State Fair Park, 640 S. 84th Street, West Allis 

TRUE Skool Summer Park Jam | August 8-10, 2025 | Daily | Free | **Kid Friendly** One-of-a-kind intergenerational platform celebrating Milwaukee connections, pride, and cultural impact. This downtown experience inspires creativity, celebrates local culture, and draws visitors from across the Midwest. Curated to align with Milwaukee's vision for talent attraction and retention, creating lasting community connections through music, art, and community programming. | Marcus Performing Arts Center, 929 N. Water Street, Milwaukee

Art & Hops with Traveling Beer Garden | June 14 - August 30, 2025 | 11:00am-5:00pm | **Kid Friendly** | Free Family-friendly series combining local art with craft beer at rotating Milwaukee area parks. Stroll through parks enjoying brews from the Traveling Beer Garden while browsing an eclectic mix of local artists, makers of high-quality handmade items, and small businesses. Multiple dates at different locations: Doctors Park Fox Point (8/9), Sheridan Park Cudahy (8/30). Perfect for a relaxed weekend afternoon. 

**GREATER MILWAUKEE AREA**

Waukesha Rotary BluesFest | Friday-Saturday, August 8-9, 2025 | 12:30pm-10:00pm | **Kid Friendly** Two-day blues festival featuring live music from 1pm-10pm daily under a large festival tent with ample seating. Local restaurants and food trucks provide specialized food selections, while the Rotary beverage tent offers craft beers from Raised Grain Brewing and Lakefront, plus wine and soft drinks. Free parking included with ticket purchase. Note: No outside food/drinks, coolers, or pets allowed. Rain or shine event. | Naga-Waukee Park, 651 State Highway 83, Delafield (25 minutes west of Milwaukee) 

21st Annual Cheese Capital Jazz and Blues Crawl | Friday, August 8, 2025 | 4:30pm-Midnight Live music extravaganza and arts fundraiser featuring 11 fantastic bands at 8 venues including Plymouth Arts Center courtyard and greatroom, plus 7 local clubs and restaurants (Antonio's, Big Billy's Bar & Grill, Moxie Café, Plank Road Distillery, Plymouth Tap, Turner Hall, and Wild Shots Pub & Grill). $10 keepsake wristband includes free trolley rides between venues (6:30pm-10:30pm). Features continuous music, Bourbon Street Café menu until 9pm, new art show in Gallery 110 North, and huge silent auction with original fine art and unique gifts. All venues accessible by trolley. | Plymouth Arts Center, 520 East Mill St, Plymouth (about 45 minutes north of Milwaukee) ",3,1,2025-08-07 17:07:36,1mkdmcn,https://www.reddit.com/r/milwaukee/comments/1mkdmcn/are_you_struggling_to_find_something_to_do_this/,milwaukee,restaurant_mention
La Caribeña The best Caribbean family restaurant,Introducing Uptown Society: Connecting Milwaukee Through Unforgettable Events,"Hey Milwaukee!

We’re Uptown Society, an event-focused organization rooted in the city we love. Our mission is simple but meaningful: to unify Milwaukee's multicultural communities through innovative and inspiring experiences.

From music showcases and family-friendly watch parties to food reviews and creative collaborations, we strive to create spaces where everyone can feel at home while having a great time. Half of the profits from our events go directly back into community initiatives because we believe in building a better Milwaukee together.

Here’s a quick snapshot of what we’re all about:

* **Events with Purpose:** Whether we host a Bucks watch party, curate a playlist of local artists, or throw unique pop-up activations, every event we plan is designed to bring people together.
* **Supporting Local:** Through projects like *Uptown Eaton* (our food review column) and *Beats, Beers & Brats* (our curated playlists), we highlight Milwaukee's amazing talent and businesses.
* **Inclusivity is Key:** Our motto, *Diversity is Dope,* says it all—we aim to connect different faces in different places to create something truly special.

We’re here to build community, collaborate, and celebrate Milwaukee's offerings. To stay informed about upcoming events or learn how to partner with us, visit our website or follow us on social media.

Milwaukee, we can’t wait to meet you! Let’s make 2025 our best year yet.

[Visit us here](http://www.theuptownsociety.com)  
\#DiversityIsDope #UptownMKE #BubblerBuddies #UptownEaton #BeatsBeersBrats

https://preview.redd.it/ietwrdr2s0ae1.jpg?width=1275&format=pjpg&auto=webp&s=8c815ad948a0fb628ff40bb55cb44d2716bccaf0

",6,5,2024-12-30 11:19:19,1hps6gj,https://www.reddit.com/r/milwaukee/comments/1hps6gj/introducing_uptown_society_connecting_milwaukee/,milwaukee,restaurant_mention
